{
  "schema_version": "devseek.r4-iteration-status-rollup/v1",
  "integrity": {
    "hash_algorithm": "sha256",
    "canonicalization_version": "devseek-canonical-json/v1"
  },
  "rollup_id": "R4-ITERATION-STATUS-ROLLUP/v1",
  "rollup_version": 1,
  "source_status": "generated-local-status-only",
  "integrity_scope": "local-r4-iteration-status-rollup",
  "does_not_add_r4_leaf": true,
  "qualification_eligible": false,
  "qualification_effect": "NONE",
  "claims_permitted": false,
  "asserts_gate_pass": false,
  "observation_authority": {
    "semantic_authority": "R4IterationStatusRollup",
    "writes_product_state": false,
    "provider_actions": "FORBIDDEN",
    "live_holdout_actions": "FORBIDDEN",
    "runtime_process_observation": "FORBIDDEN",
    "install_or_window_actions": "FORBIDDEN",
    "secret_observation": "FORBIDDEN"
  },
  "source_bindings": {
    "r3_handoff_next_phase": {
      "path": "docs/top-agent-convergence-audit-20260711/20-R3收尾与下一阶段任务.md",
      "source_sha256": "842c2725379c64ade18425ac1854bc14e971db55f2afc29328e705a0c7b52351",
      "handoff_doc_commit": "02cb792b4fe86df523c7f88eb106f13394e6f3fd"
    },
    "release_candidate_manifest": {
      "path": "docs/process/devseek-r4-release-candidate-manifest.json",
      "source_sha256": "fe0d5a74792785a640df50be50012702a46077bebe0d8036647ed27e42182f87",
      "manifest_sha256": "e99ea94658683aff63f52d8b9c8992e6c90501e441571757d068d29da6c151e4",
      "artifact_source_commit": "a034e5e050c044460fb07705639d9d41e6b193c0"
    },
    "doc_process_identity_reconciliation": {
      "path": "docs/process/devseek-r4-doc-process-identity-reconciliation.json",
      "source_sha256": "0c611270778e0cf8f851e381a08c6344546a457fce2ec131e4bb978589c2fc6d",
      "reconciliation_sha256": "0062308b89bd93c1eff593cae812d942f96ff2bb4a7b70e183030414610e9599",
      "current_candidate_identity_status": "clean-runtime-identity-established"
    },
    "live_qualification_request_packet": {
      "path": "docs/process/devseek-r4-live-qualification-request-packet.json",
      "source_sha256": "2b7bc6e3aecb20f7b2303c9a13a5d19eb1d943e28f55cf4aef52e9c30492dfc6",
      "packet_sha256": "e83c0f536ecfc7b0704b2186fe9a9f81ea7f7642b6ebd0b5d38c8b88db47b37c",
      "blocked_requests": 5
    },
    "live_user_way_holdout_matrix": {
      "path": "docs/process/devseek-r4-live-user-way-holdout-matrix.json",
      "source_sha256": "000a82523ebeb1047518c7ca32f232d1416cfccf8ec6418599428b642ed783cf",
      "matrix_sha256": "083cfc5a922afe1e571f3d46bc099c0343ff49224c8ae6ae0e461a11d420f38e",
      "live_runs_authorized": 0
    },
    "real_provider_failure_taxonomy": {
      "path": "docs/process/devseek-r4-real-provider-failure-taxonomy.json",
      "source_sha256": "8a8f761acfb83d2e89643c4f7cdfc7103fc1f39f7bc32d48a233e7b3c272ee89",
      "taxonomy_sha256": "9db65a53f787a39b5b27cf7c927f263eca2cb495e077a83f8bbb8244d8fed216",
      "categories": 10
    },
    "authorization_guide": {
      "path": "docs/process/devseek-r4-authorization-and-permission-guide.md",
      "source_sha256": "826240c4a2cfcae0c6fb1068ed199b1ffed99d64857fd8053d70e3790f40ada5"
    },
    "clean_runtime_limited_observation": {
      "path": "docs/process/devseek-r4-clean-runtime-limited-observation.json",
      "source_sha256": "005084a18681dc69df73e10fb5922024ed31fc3df1c34ba9d5858439556e6ada",
      "observation_sha256": "f1aa92bd3a06487bf52c61aa44389f3e4a3dd51a87500c53d385bc5c53333006",
      "terminal_state": "COMPLETED",
      "clean_runtime_identity_established": true,
      "stable_runtime_count": 1
    }
  },
  "r4_scope": {
    "product_implementation_commit": "a034e5e050c044460fb07705639d9d41e6b193c0",
    "handoff_doc_commit": "02cb792b4fe86df523c7f88eb106f13394e6f3fd",
    "total_leaf_count": 6,
    "local_process_artifacts_complete_except_clean_runtime": true,
    "clean_runtime_leaf_terminal_state": "COMPLETED",
    "clean_runtime_limited_observation_terminal_state": "COMPLETED",
    "clean_runtime_limited_observation_sha256": "f1aa92bd3a06487bf52c61aa44389f3e4a3dd51a87500c53d385bc5c53333006",
    "clean_runtime_stable_runtime_count": 1,
    "current_candidate_identity_status": "clean-runtime-identity-established",
    "gate0_status": "NOT_PASSED",
    "r1_qualification_status": "NOT_STARTED",
    "release_candidate_vsix_sha256": "027ef950a79a576444eaf3075d689b44ef0af8bec3d22df65ca61ed2cc1df19d",
    "scenario_language_source": "scenario-contract"
  },
  "clean_runtime_boundary": {
    "leaf_id": "R4-CANDIDATE-IDENTITY-CLEAN-RUNTIME",
    "may_close_existing_vscode_or_deepseek_pages": false,
    "may_run_live_provider_test": false,
    "may_install_or_replace_extension": false,
    "may_refresh_current_candidate_identity_without_authorization": false,
    "acceptable_next_authority": [],
    "latest_limited_observation_path": "docs/process/devseek-r4-clean-runtime-limited-observation.json",
    "latest_limited_observation_terminal_state": "COMPLETED",
    "latest_limited_observation_clean_runtime_identity_established": true,
    "blocked_until_authority": false
  },
  "leaves": [
    {
      "leaf_id": "R4-CANDIDATE-IDENTITY-CLEAN-RUNTIME",
      "terminal_state": "COMPLETED",
      "implementation_commit": "a034e5e050c044460fb07705639d9d41e6b193c0",
      "artifact_path": "docs/process/devseek-current-candidate-identity.json",
      "blocker_reason": null,
      "next_required_authority": null,
      "qualification_effect": "NONE",
      "claims_permitted": false,
      "asserts_gate_pass": false
    },
    {
      "leaf_id": "R4-RELEASE-CANDIDATE-MANIFEST",
      "terminal_state": "COMPLETED",
      "implementation_commit": "33bd4e9685e0577b92806938919a8370ab49caa6",
      "artifact_path": "docs/process/devseek-r4-release-candidate-manifest.json",
      "blocker_reason": null,
      "next_required_authority": null,
      "qualification_effect": "NONE",
      "claims_permitted": false,
      "asserts_gate_pass": false
    },
    {
      "leaf_id": "R4-DOC-PROCESS-IDENTITY-RECONCILIATION",
      "terminal_state": "COMPLETED",
      "implementation_commit": "7a5c1acfa2745d411bb3c6ac97088ef5c87efade",
      "artifact_path": "docs/process/devseek-r4-doc-process-identity-reconciliation.json",
      "blocker_reason": null,
      "next_required_authority": null,
      "qualification_effect": "NONE",
      "claims_permitted": false,
      "asserts_gate_pass": false
    },
    {
      "leaf_id": "R4-LIVE-QUALIFICATION-REQUEST-PACKET",
      "terminal_state": "COMPLETED",
      "implementation_commit": "8da611877948d53854000b7258721b6d43dc8e81",
      "artifact_path": "docs/process/devseek-r4-live-qualification-request-packet.json",
      "blocker_reason": null,
      "next_required_authority": null,
      "qualification_effect": "NONE",
      "claims_permitted": false,
      "asserts_gate_pass": false
    },
    {
      "leaf_id": "R4-LIVE-USER-WAY-HOLDOUT-MATRIX",
      "terminal_state": "COMPLETED",
      "implementation_commit": "49a380f1bb193a69a945791f8cf97c7ceac7b1b8",
      "artifact_path": "docs/process/devseek-r4-live-user-way-holdout-matrix.json",
      "blocker_reason": null,
      "next_required_authority": null,
      "qualification_effect": "NONE",
      "claims_permitted": false,
      "asserts_gate_pass": false
    },
    {
      "leaf_id": "R4-REAL-PROVIDER-FAILURE-TAXONOMY",
      "terminal_state": "COMPLETED",
      "implementation_commit": "e547c6db75712ed2dd649fa7192a40e9382a5028",
      "artifact_path": "docs/process/devseek-r4-real-provider-failure-taxonomy.json",
      "blocker_reason": null,
      "next_required_authority": null,
      "qualification_effect": "NONE",
      "claims_permitted": false,
      "asserts_gate_pass": false
    }
  ],
  "counts": {
    "r4_total_leaves": 6,
    "completed_leaves": 6,
    "blocked_leaves": 0,
    "remaining_window_sensitive_leaves": 0,
    "live_runs_authorized": 0,
    "qualification_claims": 0
  },
  "rollup_sha256": "abd12eec6402e54993a19d2918eb976d027bf5e80682870cc1032c0061a85cb1"
}
